{
  "schema_version": "1.0",
  "status": "candidate",
  "structure": {
    "passed": true,
    "errors": []
  },
  "privacy": {
    "passed": true,
    "errors": [],
    "image_redaction_verified": false
  },
  "outcome": {
    "status": "passed",
    "supporting_check_ids": [
      "c1",
      "c2"
    ],
    "source": "synthetic_fixture"
  },
  "review": {
    "status": "candidate",
    "accepted_revision": null
  },
  "reruns": [
    {
      "kind": "live_runner",
      "status": "pending",
      "revision": 1,
      "details": "Main PLVA runtime integration required; no actual changed-layout execution recorded."
    }
  ],
  "warnings": [
    "Text scanning does not verify image redaction.",
    "Actual changed-layout execution through the main runtime is pending.",
    "Candidate was generated by the deterministic mock, not Astra."
  ]
}
